SERVICE	HBASE	service_config_suppression_hbase_snapshot_s3_secret_access_key	false		Suppress Parameter Validation: AWS S3 Secret Access Key for Remote Snapshots
SERVICE	HBASE	service_config_suppression_hbaserestserver_count_validator	false		Suppress Configuration Validator: HBase REST Server Count Validator
SERVICE	HBASE	zookeeper_pause	false	zookeeper.pause	ZooKeeper Connection Retry Pause Duration
SERVICE	HBASE	hbase_skip_reload_during_rr	false		Skip Region Reload During Rolling Restart
SERVICE	HBASE	dfs_client_read_shortcircuit	false	dfs.client.read.shortcircuit	Enable HDFS Short-Circuit Read
SERVICE	HBASE	service_config_suppression_hbase_superuser	false		Suppress Parameter Validation: HBase Superusers
SERVICE	HBASE	zookeeper_session_timeout	false	zookeeper.session.timeout	ZooKeeper Session Timeout
SERVICE	HBASE	navigator_event_tracker	false	navigator_event_tracker	Audit Event Tracker
SERVICE	HBASE	hbase_canary_alert_unhealthy_region_percent_threshold	false		HBase Canary Unhealthy Region Percentage Alert Threshold
SERVICE	HBASE	hbase_server_dfs_client_hedged_read_threadpool_size	false	dfs.client.hedged.read.threadpool.size	HDFS Hedged Read Threadpool Size
SERVICE	HBASE	hbase_restserver_security_authentication	false	hbase.rest.authentication.type	HBase REST Authentication
SERVICE	HBASE	hbase_replication_source_nb_capacity	false	replication.source.nb.capacity	Replication Batch Size
SERVICE	HBASE	hbase_enable_replication	false	hbase.replication	Enable Replication
SERVICE	HBASE	kerberos_princ_name	false		Kerberos Principal
SERVICE	HBASE	navigator_audit_event_filter	false	navigator.event.filter	Audit Event Filter
SERVICE	HBASE	hbase_service_splitlog_manager_timeout	false	hbase.splitlog.manager.timeout	SplitLog Manager Timeout
SERVICE	HBASE	hbase_server_dfs_client_hedged_read_threshold_millis	false	dfs.client.hedged.read.threshold.millis	HDFS Hedged Read Delay Threshold
SERVICE	HBASE	service_config_suppression_hbase_snapshot_s3_access_key_id	false		Suppress Parameter Validation: Amazon S3 Access Key ID for Remote Snapshots
SERVICE	HBASE	hbase_core_site_safety_valve	false		HBase Service Advanced Configuration Snippet (Safety Valve) for core-site.xml
SERVICE	HBASE	hbase_snapshot_s3_path	false		Amazon S3 Path for Remote Snapshots
SERVICE	HBASE	service_config_suppression_kerberos_princ_name	false		Suppress Parameter Validation: Kerberos Principal
SERVICE	HBASE	navigator_audit_log_max_file_size	false	navigator.audit_log_max_file_size	Maximum Audit Log File Size
SERVICE	HBASE	hbase_superuser	false	hbase.superuser	HBase Superusers
SERVICE	HBASE	service_config_suppression_zookeeper_max_session_timeout_validator	false		Suppress Configuration Validator: ZooKeeper Max Session Timeout Validator
SERVICE	HBASE	service_health_suppression_hbase_master_health	false		Suppress Health Test: HBase Master Health
SERVICE	HBASE	service_config_suppression_smon_derived_configs_safety_valve	false		Suppress Parameter Validation: Service Monitor Derived Configs Advanced Configuration Snippet (Safety Valve)
SERVICE	HBASE	hbase_client_retries_number	false	hbase.client.retries.number	Maximum HBase Client Retries
SERVICE	HBASE	hbase_client_pause	false	hbase.client.pause	HBase Client Pause
SERVICE	HBASE	hbase_regionserver_enable_canary	false		Enable HBase Canary
SERVICE	HBASE	hbase_snapshot_region_timeout	false	hbase.snapshot.region.timeout	HBase RegionServer Snapshot Timeout
SERVICE	HBASE	hbase_secure_rpc_engine	false	hbase.secure.rpc.engine	HBase Secure RPC Engine
SERVICE	HBASE	service_config_suppression_hbase_region_health_canary_exclude_tables	false		Suppress Parameter Validation: HBase Region Health Canary Exclude Tables
SERVICE	HBASE	ssl_server_keystore_keypassword	false	ssl.server.keystore.keypassword	HBase TLS/SSL Server JKS Keystore Key Password
SERVICE	HBASE	service_config_suppression_navigator_event_tracker	false		Suppress Parameter Validation: Audit Event Tracker
SERVICE	HBASE	hbase_region_health_canary_slow_run_alert_enabled	false		HBase Region Health Canary Slow Run Alert Enabled
SERVICE	HBASE	service_config_suppression_smon_client_config_overrides	false		Suppress Parameter Validation: Service Monitor Client Config Overrides
SERVICE	HBASE	hbase_server_thread_wakefrequency	false	hbase.server.thread.wakefrequency	HBase Server Thread Wake Frequency
SERVICE	HBASE	service_config_suppression_hbase_ssl_server_safety_valve	false		Suppress Parameter Validation: HBase Service Advanced Configuration Snippet (Safety Valve) for ssl-server.xml
SERVICE	HBASE	hbase_snapshot_master_timeoutMillis	false	hbase.snapshot.master.timeoutMillis	HBase Master Snapshot Waiting Timeout
SERVICE	HBASE	ssl_server_keystore_location	false	ssl.server.keystore.location	HBase TLS/SSL Server JKS Keystore File Location
SERVICE	HBASE	service_config_suppression_ssl_server_keystore_password	false		Suppress Parameter Validation: HBase TLS/SSL Server JKS Keystore File Password
SERVICE	HBASE	service_config_suppression_short_circuit_read_validator	false		Suppress Configuration Validator: Short-Circuit Read Enabled Validator
SERVICE	HBASE	service_config_suppression_audit_event_log_dir	false		Suppress Parameter Validation: Audit Log Directory
SERVICE	HBASE	hbase_snapshot_s3_secret_access_key	false		AWS S3 Secret Access Key for Remote Snapshots
SERVICE	HBASE	hbase_canary_alert_unhealthy_region_count_threshold	false		HBase Canary Unhealthy Region Count Alert Threshold
SERVICE	HBASE	hbase_rpc_timeout	false	hbase.rpc.timeout	RPC Timeout
SERVICE	HBASE	hbase_snapshot_s3_access_key_id	false		Amazon S3 Access Key ID for Remote Snapshots
SERVICE	HBASE	process_username	false		System User
SERVICE	HBASE	enable_config_alerts	false		Enable Configuration Change Alerts
SERVICE	HBASE	hbase_region_health_canary_enabled	false		HBase Region Health Canary
SERVICE	HBASE	ssl_server_keystore_password	false	ssl.server.keystore.password	HBase TLS/SSL Server JKS Keystore File Password
SERVICE	HBASE	service_config_suppression_hbase_authentication_and_authorization_validator	false		Suppress Configuration Validator: HBase Authentication And Authorization Validation
SERVICE	HBASE	hbase_hadoop_ssl_enabled	false	hadoop.ssl.enabled	Web UI TLS/SSL Encryption Enabled
SERVICE	HBASE	log_event_retry_frequency	false		Log Event Retry Frequency
SERVICE	HBASE	service_config_suppression_hbase_service_env_safety_valve	false		Suppress Parameter Validation: HBase Service Environment Advanced Configuration Snippet (Safety Valve)
ROLE	HBASETHRIFTSERVER	hbase_thriftserver_compact	false	hbase.regionserver.thrift.compact	Enable HBase Thrift Server Compact Protocol
ROLE	HBASETHRIFTSERVER	role_health_suppression_hbase_thrift_server_unexpected_exits	false		Suppress Health Test: Unexpected Exits
ROLE	HBASETHRIFTSERVER	log_threshold	false		HBase Thrift Server Logging Threshold
ROLE	HBASETHRIFTSERVER	stacks_collection_data_retention	false	stacks_collection_data_retention	Stacks Collection Data Retention
ROLE	HBASETHRIFTSERVER	role_health_suppression_hbase_thrift_server_swap_memory_usage	false		Suppress Health Test: Swap Memory Usage
ROLE	HBASETHRIFTSERVER	role_config_suppression_cdh_version_validator	false		Suppress Configuration Validator: CDH Version Validator
ROLE	HBASETHRIFTSERVER	hbase_thriftserver_java_opts	false		Java Configuration Options for HBase Thrift Server
ROLE	HBASETHRIFTSERVER	stacks_collection_enabled	false	stacks_collection_enabled	Stacks Collection Enabled
ROLE	HBASETHRIFTSERVER	role_config_suppression_hbase_thriftserver_java_opts	false		Suppress Parameter Validation: Java Configuration Options for HBase Thrift Server
ROLE	HBASETHRIFTSERVER	enable_alerts	false		Enable Health Alerts for this Role
ROLE	HBASETHRIFTSERVER	rm_memory_soft_limit	false	memory.soft_limit_in_bytes	Cgroup Memory Soft Limit
ROLE	HBASETHRIFTSERVER	process_auto_restart	false		Automatically Restart Process
ROLE	HBASETHRIFTSERVER	oom_heap_dump_dir	false	oom_heap_dump_dir	Heap Dump Directory
ROLE	HBASETHRIFTSERVER	log_event_whitelist	false		Rules to Extract Events from Log Files
ROLE	HBASETHRIFTSERVER	role_config_suppression_hbase_thriftserver_dns_interface	false		Suppress Parameter Validation: HBase Thrift Server DNS Network Interface
ROLE	HBASETHRIFTSERVER	hbase_thriftserver_log_dir	false	hadoop.log.dir	HBase Thrift Server Log Directory
ROLE	HBASETHRIFTSERVER	hbase_thriftserver_bindaddress	false	hbase.regionserver.thrift.ipaddress	HBase Thrift Server Bind Address
ROLE	HBASETHRIFTSERVER	role_config_suppression_hbase_thriftserver_log_dir	false		Suppress Parameter Validation: HBase Thrift Server Log Directory
ROLE	HBASETHRIFTSERVER	hbase_thriftserver_config_safety_valve	false		HBase Thrift Server Advanced Configuration Snippet (Safety Valve) for hbase-site.xml
ROLE	HBASETHRIFTSERVER	role_config_suppression_log4j_safety_valve	false		Suppress Parameter Validation: HBase Thrift Server Logging Advanced Configuration Snippet (Safety Valve)
ROLE	HBASETHRIFTSERVER	rlimit_fds	false		Maximum Process File Descriptors
ROLE	HBASETHRIFTSERVER	log4j_safety_valve	false		HBase Thrift Server Logging Advanced Configuration Snippet (Safety Valve)
ROLE	HBASETHRIFTSERVER	max_log_size	false		HBase Thrift Server Max Log Size
ROLE	HBASETHRIFTSERVER	unexpected_exits_thresholds	false		Unexpected Exits Thresholds
ROLE	HBASETHRIFTSERVER	stacks_collection_frequency	false	stacks_collection_frequency	Stacks Collection Frequency
ROLE	HBASETHRIFTSERVER	role_health_suppression_hbase_thrift_server_heap_dump_directory_free_space	false		Suppress Health Test: Heap Dump Directory Free Space
ROLE	HBASETHRIFTSERVER	log_directory_free_space_percentage_thresholds	false		Log Directory Free Space Monitoring Percentage Thresholds
ROLE	HBASETHRIFTSERVER	hbase_thriftserver_info_bind_to_wildcard	false	hbase.thrift.info.bindAddress	HBase Thrift Server Web UI Bind to Wildcard Address
ROLE	HBASETHRIFTSERVER	log_directory_free_space_absolute_thresholds	false		Log Directory Free Space Monitoring Absolute Thresholds
ROLE	HBASETHRIFTSERVER	oom_heap_dump_enabled	false		Dump Heap When Out of Memory
ROLE	HBASETHRIFTSERVER	max_log_backup_index	false		HBase Thrift Server Maximum Log File Backups
ROLE	HBASETHRIFTSERVER	heap_dump_directory_free_space_percentage_thresholds	false		Heap Dump Directory Free Space Monitoring Percentage Thresholds
ROLE	HBASETHRIFTSERVER	unexpected_exits_window	false		Unexpected Exits Monitoring Period
ROLE	HBASETHRIFTSERVER	stacks_collection_method	false	stacks_collection_method	Stacks Collection Method
ROLE	HBASETHRIFTSERVER	hbasethriftserver_scm_health_enabled	false		HBase Thrift Server Process Health Test
ROLE	HBASETHRIFTSERVER	hbase_thriftserver_type	false	hbase.regionserver.thrift.server.type	HBase Thrift Server Type
ROLE	HBASETHRIFTSERVER	hbase_thriftserver_min_worker_threads	false	hbase.thrift.minWorkerThreads	HBase Thrift Server Min Worker Threads
ROLE	HBASETHRIFTSERVER	hbase_thriftserver_java_heapsize	false		Java Heap Size of HBase Thrift Server in Bytes
ROLE	HBASETHRIFTSERVER	role_health_suppression_hbase_thrift_server_file_descriptor	false		Suppress Health Test: File Descriptors
ROLE	HBASETHRIFTSERVER	role_health_suppression_hbase_thrift_server_log_directory_free_space	false		Suppress Health Test: Log Directory Free Space
ROLE	HBASETHRIFTSERVER	HBASETHRIFTSERVER_role_env_safety_valve	false		HBase Thrift Server Environment Advanced Configuration Snippet (Safety Valve)
ROLE	HBASETHRIFTSERVER	hbase_thriftserver_info_port	false	hbase.thrift.info.port	HBase Thrift Server Web UI Port
ROLE	HBASETHRIFTSERVER	role_config_suppression_stacks_collection_directory	false		Suppress Parameter Validation: Stacks Collection Directory
ROLE	HBASETHRIFTSERVER	oom_sigkill_enabled	false		Kill When Out of Memory
ROLE	HBASETHRIFTSERVER	role_config_suppression_oom_heap_dump_dir	false		Suppress Parameter Validation: Heap Dump Directory
ROLE	HBASETHRIFTSERVER	role_config_suppression_hbasethriftserver_role_env_safety_valve	false		Suppress Parameter Validation: HBase Thrift Server Environment Advanced Configuration Snippet (Safety Valve)
ROLE	HBASETHRIFTSERVER	role_config_suppression_hbase_thriftserver_config_safety_valve	false		Suppress Parameter Validation: HBase Thrift Server Advanced Configuration Snippet (Safety Valve) for hbase-site.xml
ROLE	HBASETHRIFTSERVER	role_config_suppression_hbase_thriftserver_dns_nameserver	false		Suppress Parameter Validation: HBase Thrift Server DNS Name Server
ROLE	HBASETHRIFTSERVER	hbasethriftserver_host_health_enabled	false		HBase Thrift Server Host Health Test
ROLE	HBASETHRIFTSERVER	rm_memory_hard_limit	false	memory.limit_in_bytes	Cgroup Memory Hard Limit
ROLE	HBASETHRIFTSERVER	role_config_suppression_log_event_whitelist	false		Suppress Parameter Validation: Rules to Extract Events from Log Files
ROLE	HBASETHRIFTSERVER	rm_cpu_shares	false	cpu.shares	Cgroup CPU Shares
ROLE	HBASETHRIFTSERVER	role_config_suppression_role_triggers	false		Suppress Parameter Validation: Role Triggers
ROLE	HBASETHRIFTSERVER	stacks_collection_directory	false	stacks_collection_directory	Stacks Collection Directory
ROLE	HBASETHRIFTSERVER	role_config_suppression_hbase_thriftserver_bindaddress	false		Suppress Parameter Validation: HBase Thrift Server Bind Address
ROLE	HBASETHRIFTSERVER	hbase_thriftserver_framed	false	hbase.regionserver.thrift.framed	Enable HBase Thrift Server Framed Transport
ROLE	HBASETHRIFTSERVER	heap_dump_directory_free_space_absolute_thresholds	false		Heap Dump Directory Free Space Monitoring Absolute Thresholds
ROLE	HBASETHRIFTSERVER	rm_io_weight	false	blkio.weight	Cgroup I/O Weight
ROLE	HBASETHRIFTSERVER	hbase_thriftserver_port	false	hbase.regionserver.thrift.port	HBase Thrift Server Port
ROLE	HBASETHRIFTSERVER	role_health_suppression_hbase_thrift_server_host_health	false		Suppress Health Test: Host Health
ROLE	HBASETHRIFTSERVER	enable_config_alerts	false		Enable Configuration Change Alerts
ROLE	HBASETHRIFTSERVER	role_health_suppression_hbase_thrift_server_scm_health	false		Suppress Health Test: Process Status
ROLE	HBASETHRIFTSERVER	role_triggers	false		Role Triggers
ROLE	HBASETHRIFTSERVER	hbasethriftserver_fd_thresholds	false		File Descriptor Monitoring Thresholds
ROLE	HBASETHRIFTSERVER	process_swap_memory_thresholds	false		Process Swap Memory Thresholds
ROLE	HBASETHRIFTSERVER	hbase_thriftserver_dns_nameserver	false	hbase.thrift.dns.nameserver	HBase Thrift Server DNS Name Server
ROLE	HBASETHRIFTSERVER	hbase_thriftserver_dns_interface	false	hbase.thrift.dns.interface	HBase Thrift Server DNS Network Interface
ROLE	MASTER	hbase_master_log_dir	false	hadoop.log.dir	Master Log Directory
ROLE	MASTER	log_threshold	false		Master Logging Threshold
ROLE	MASTER	stacks_collection_data_retention	false	stacks_collection_data_retention	Stacks Collection Data Retention
ROLE	MASTER	role_config_suppression_cdh_version_validator	false		Suppress Configuration Validator: CDH Version Validator
ROLE	MASTER	hbase_master_config_safety_valve	false		Master Advanced Configuration Snippet (Safety Valve) for hbase-site.xml
ROLE	MASTER	role_config_suppression_hbase_master_info_bindaddress	false		Suppress Parameter Validation: HBase Master Web UI Address
ROLE	MASTER	hbase_master_logcleaner_ttl	false	hbase.master.logcleaner.ttl	Maximum Time to Keep HLogs
ROLE	MASTER	role_config_suppression_hbase_master_dns_interface	false		Suppress Parameter Validation: HBase Master DNS Network Interface
ROLE	MASTER	stacks_collection_enabled	false	stacks_collection_enabled	Stacks Collection Enabled
ROLE	MASTER	role_config_suppression_hbase_master_log_dir	false		Suppress Parameter Validation: Master Log Directory
ROLE	MASTER	role_config_suppression_hbase_master_dns_nameserver	false		Suppress Parameter Validation: HBase Master DNS Name Server
ROLE	MASTER	role_config_suppression_hbase_master_config_safety_valve	false		Suppress Parameter Validation: Master Advanced Configuration Snippet (Safety Valve) for hbase-site.xml
ROLE	MASTER	role_health_suppression_master_web_metric_collection	false		Suppress Health Test: Web Server Status
ROLE	MASTER	role_config_suppression_hbase_master_java_opts	false		Suppress Parameter Validation: Java Configuration Options for HBase Master
ROLE	MASTER	master_scm_health_enabled	false		Master Process Health Test
ROLE	MASTER	hbase_coprocessor_master_classes	false	hbase.coprocessor.master.classes	HBase Coprocessor Master Classes
ROLE	MASTER	enable_alerts	false		Enable Health Alerts for this Role
ROLE	MASTER	rm_memory_soft_limit	false	memory.soft_limit_in_bytes	Cgroup Memory Soft Limit
ROLE	MASTER	master_web_metric_collection_enabled	false		Web Metric Collection
ROLE	MASTER	process_auto_restart	false		Automatically Restart Process
ROLE	MASTER	log_event_whitelist	false		Rules to Extract Events from Log Files
ROLE	MASTER	oom_heap_dump_dir	false	oom_heap_dump_dir	Heap Dump Directory
ROLE	MASTER	role_config_suppression_master_role_env_safety_valve	false		Suppress Parameter Validation: Master Environment Advanced Configuration Snippet (Safety Valve)
ROLE	MASTER	role_config_suppression_hadoop_metrics2_safety_valve	false		Suppress Parameter Validation: Hadoop Metrics2 Advanced Configuration Snippet (Safety Valve)
ROLE	MASTER	hbase_master_executor_openregion_threads	false	hbase.master.executor.openregion.threads	Region Opening Threads
ROLE	MASTER	role_config_suppression_log4j_safety_valve	false		Suppress Parameter Validation: Master Logging Advanced Configuration Snippet (Safety Valve)
ROLE	MASTER	role_health_suppression_master_canary_health	false		Suppress Health Test: HBase Master Canary
ROLE	MASTER	rlimit_fds	false		Maximum Process File Descriptors
ROLE	MASTER	log4j_safety_valve	false		Master Logging Advanced Configuration Snippet (Safety Valve)
ROLE	MASTER	max_log_size	false		Master Max Log Size
ROLE	MASTER	hbase_master_port	false	hbase.master.port	HBase Master Port
ROLE	MASTER	unexpected_exits_thresholds	false		Unexpected Exits Thresholds
ROLE	MASTER	master_gc_duration_window	false		Garbage Collection Duration Monitoring Period
ROLE	MASTER	stacks_collection_frequency	false	stacks_collection_frequency	Stacks Collection Frequency
ROLE	MASTER	log_directory_free_space_percentage_thresholds	false		Log Directory Free Space Monitoring Percentage Thresholds
ROLE	MASTER	role_health_suppression_master_scm_health	false		Suppress Health Test: Process Status
ROLE	MASTER	role_config_suppression_hbase_master_logcleaner_plugins	false		Suppress Parameter Validation: HBase Master Log Cleaner Plugins
ROLE	MASTER	master_startup_tolerance	false		Health Check Startup Tolerance
ROLE	MASTER	log_directory_free_space_absolute_thresholds	false		Log Directory Free Space Monitoring Absolute Thresholds
ROLE	MASTER	oom_heap_dump_enabled	false		Dump Heap When Out of Memory
ROLE	MASTER	master_web_metric_collection_thresholds	false		Web Metric Collection Duration
ROLE	MASTER	max_log_backup_index	false		Master Maximum Log File Backups
ROLE	MASTER	hbase_master_executor_closeregion_threads	false	hbase.master.executor.closeregion.threads	Region Closing Threads
ROLE	MASTER	hbase_master_dns_nameserver	false	hbase.master.dns.nameserver	HBase Master DNS Name Server
ROLE	MASTER	hbase_master_logcleaner_plugins	false	hbase.master.logcleaner.plugins	HBase Master Log Cleaner Plugins
ROLE	MASTER	heap_dump_directory_free_space_percentage_thresholds	false		Heap Dump Directory Free Space Monitoring Percentage Thresholds
ROLE	MASTER	unexpected_exits_window	false		Unexpected Exits Monitoring Period
ROLE	MASTER	hbase_metrics_extended_period	false	hbase.extendedperiod	Extended Period
ROLE	MASTER	stacks_collection_method	false	stacks_collection_method	Stacks Collection Method
ROLE	MASTER	hbase_master_java_heapsize	false		Java Heap Size of HBase Master in Bytes
ROLE	MASTER	role_health_suppression_master_heap_dump_directory_free_space	false		Suppress Health Test: Heap Dump Directory Free Space
ROLE	MASTER	role_config_suppression_stacks_collection_directory	false		Suppress Parameter Validation: Stacks Collection Directory
ROLE	MASTER	role_health_suppression_master_file_descriptor	false		Suppress Health Test: File Descriptors
ROLE	MASTER	oom_sigkill_enabled	false		Kill When Out of Memory
ROLE	MASTER	role_config_suppression_oom_heap_dump_dir	false		Suppress Parameter Validation: Heap Dump Directory
ROLE	MASTER	master_gc_duration_thresholds	false		Garbage Collection Duration Thresholds
ROLE	MASTER	rm_memory_hard_limit	false	memory.limit_in_bytes	Cgroup Memory Hard Limit
ROLE	MASTER	role_config_suppression_log_event_whitelist	false		Suppress Parameter Validation: Rules to Extract Events from Log Files
ROLE	MASTER	role_health_suppression_master_log_directory_free_space	false		Suppress Health Test: Log Directory Free Space
ROLE	MASTER	rm_cpu_shares	false	cpu.shares	Cgroup CPU Shares
ROLE	MASTER	master_fd_thresholds	false		File Descriptor Monitoring Thresholds
ROLE	MASTER	role_config_suppression_role_triggers	false		Suppress Parameter Validation: Role Triggers
ROLE	MASTER	stacks_collection_directory	false	stacks_collection_directory	Stacks Collection Directory
ROLE	MASTER	heap_dump_directory_free_space_absolute_thresholds	false		Heap Dump Directory Free Space Monitoring Absolute Thresholds
ROLE	MASTER	master_host_health_enabled	false		Master Host Health Test
ROLE	MASTER	rm_io_weight	false	blkio.weight	Cgroup I/O Weight
ROLE	MASTER	role_health_suppression_master_swap_memory_usage	false		Suppress Health Test: Swap Memory Usage
ROLE	MASTER	master_canary_health_enabled	false		HBase Master Canary Health Test
ROLE	MASTER	hadoop_metrics2_safety_valve	false		Hadoop Metrics2 Advanced Configuration Snippet (Safety Valve)
ROLE	MASTER	role_health_suppression_master_unexpected_exits	false		Suppress Health Test: Unexpected Exits
ROLE	MASTER	hbase_master_info_port	false	hbase.master.info.port	HBase Master Web UI Port
ROLE	MASTER	hbase_master_dns_interface	false	hbase.master.dns.interface	HBase Master DNS Network Interface
ROLE	MASTER	hbase_master_bind_to_wildcard_address	false	hbase.master.ipc.address	HBase Master Bind to Wildcard Address
ROLE	MASTER	hbase_master_handler_count	false	hbase.master.handler.count	HBase Master Handler Count
ROLE	MASTER	MASTER_role_env_safety_valve	false		Master Environment Advanced Configuration Snippet (Safety Valve)
ROLE	MASTER	enable_config_alerts	false		Enable Configuration Change Alerts
ROLE	MASTER	role_health_suppression_master_host_health	false		Suppress Health Test: Host Health
ROLE	MASTER	role_health_suppression_master_gc_duration	false		Suppress Health Test: GC Duration
ROLE	MASTER	hbase_master_java_opts	false		Java Configuration Options for HBase Master
ROLE	MASTER	role_triggers	false		Role Triggers
ROLE	MASTER	process_swap_memory_thresholds	false		Process Swap Memory Thresholds
ROLE	MASTER	hbase_master_executor_serverops_threads	false	hbase.master.executor.serverops.threads	RegionServer Recovery Threads
ROLE	MASTER	role_config_suppression_hbase_coprocessor_master_classes	false		Suppress Parameter Validation: HBase Coprocessor Master Classes
ROLE	MASTER	hbase_master_info_bindAddress	false	hbase.master.info.bindAddress	HBase Master Web UI Address
ROLE	REGIONSERVER	role_config_suppression_hbase_hregion_majorcompaction	false		Suppress Parameter Validation: HBase HRegion Major Compaction
ROLE	REGIONSERVER	hbase_regionserver_bind_to_wildcard_address	false	hbase.regionserver.ipc.address	HBase RegionServer Bind to Wildcard Address
ROLE	REGIONSERVER	role_config_suppression_hbase_regionserver_hlog_reader_impl	false		Suppress Parameter Validation: HLog Reader Implementation
ROLE	REGIONSERVER	hbase_regionserver_optionallogflushinterval	false	hbase.regionserver.optionallogflushinterval	Synch Interval of HLog Entries
ROLE	REGIONSERVER	log_threshold	false		RegionServer Logging Threshold
ROLE	REGIONSERVER	hbase_hregion_majorcompaction_jitter	false	hbase.hregion.majorcompaction.jitter	HBase HRegion Major Compaction Jitter
ROLE	REGIONSERVER	role_config_suppression_cdh_version_validator	false		Suppress Configuration Validator: CDH Version Validator
ROLE	REGIONSERVER	hbase_regionserver_handler_count	false	hbase.regionserver.handler.count	HBase RegionServer Handler Count
ROLE	REGIONSERVER	role_health_suppression_region_server_swap_memory_usage	false		Suppress Health Test: Swap Memory Usage
ROLE	REGIONSERVER	enable_alerts	false		Enable Health Alerts for this Role
ROLE	REGIONSERVER	hbase_regionserver_maxlogs	false	hbase.regionserver.maxlogs	Maximum number of Write-Ahead Log (WAL) files
ROLE	REGIONSERVER	rm_memory_soft_limit	false	memory.soft_limit_in_bytes	Cgroup Memory Soft Limit
ROLE	REGIONSERVER	role_config_suppression_hbase_bulkload_staging_dir	false		Suppress Parameter Validation: HBase Secure Bulk Load Directory
ROLE	REGIONSERVER	regionserver_memstore_size_thresholds	false		HBase RegionServer Memstore Size Thresholds
ROLE	REGIONSERVER	log_event_whitelist	false		Rules to Extract Events from Log Files
ROLE	REGIONSERVER	oom_heap_dump_dir	false	oom_heap_dump_dir	Heap Dump Directory
ROLE	REGIONSERVER	role_health_suppression_region_server_gc_duration	false		Suppress Health Test: GC Duration
ROLE	REGIONSERVER	hbase_ipc_server_read_threadpool_size	false	hbase.ipc.server.read.threadpool.size	RegionServer IPC Read Threadpool Size
ROLE	REGIONSERVER	hbase_regionserver_java_opts	false		Java Configuration Options for HBase RegionServer
ROLE	REGIONSERVER	hbase_regionserver_logroll_period	false	hbase.regionserver.logroll.period	HBase RegionServer Log Roll Period
ROLE	REGIONSERVER	rlimit_fds	false		Maximum Process File Descriptors
ROLE	REGIONSERVER	log4j_safety_valve	false		RegionServer Logging Advanced Configuration Snippet (Safety Valve)
ROLE	REGIONSERVER	hfile_block_cache_size	false	hfile.block.cache.size	HFile Block Cache Size
ROLE	REGIONSERVER	unexpected_exits_thresholds	false		Unexpected Exits Thresholds
ROLE	REGIONSERVER	stacks_collection_frequency	false	stacks_collection_frequency	Stacks Collection Frequency
ROLE	REGIONSERVER	hbase_hregion_max_filesize	false	hbase.hregion.max.filesize	HBase Maximum File Size
