SERVICE	HIVE	service_config_suppression_hive_sentry_server	false		Suppress Parameter Validation: Server Name for Sentry Authorization
SERVICE	HIVE	service_config_suppression_process_username	false		Suppress Parameter Validation: System User
SERVICE	HIVE	audit_event_log_dir	false	audit_event_log_dir	Audit Log Directory
SERVICE	HIVE	mapreduce_yarn_service	true		MapReduce Service
SERVICE	HIVE	service_config_suppression_hive_sentry_provider_resource	false		Suppress Parameter Validation: Sentry Global Policy File
SERVICE	HIVE	service_config_suppression_navigator_audit_event_filter	false		Suppress Parameter Validation: Audit Event Filter
SERVICE	HIVE	smon_derived_configs_safety_valve	false		Service Monitor Derived Configs Advanced Configuration Snippet (Safety Valve)
SERVICE	HIVE	service_config_suppression_navigator_client_config_safety_valve	false		Suppress Parameter Validation: Hive Client Advanced Configuration Snippet (Safety Valve) for navigator.client.properties
SERVICE	HIVE	hive_max_reducers	false	hive.exec.reducers.max	Hive Max Reducers
SERVICE	HIVE	hive_sentry_provider	false	hive.sentry.provider	Sentry User to Group Mapping Class
SERVICE	HIVE	service_config_suppression_hive_replication_env_safety_valve	false		Suppress Parameter Validation: Hive Replication Environment Advanced Configuration Snippet (Safety Valve)
SERVICE	HIVE	service_config_suppression_hiveserver2_ldap_domain	false		Suppress Parameter Validation: Active Directory Domain
SERVICE	HIVE	hive_server2_sentry_safety_valve	false		Hive Service Advanced Configuration Snippet (Safety Valve) for sentry-site.xml
SERVICE	HIVE	service_config_suppression_process_groupname	false		Suppress Parameter Validation: System Group
SERVICE	HIVE	hiveserver2_truststore_file	false		HiveServer2 TLS/SSL Certificate Trust Store File
SERVICE	HIVE	enable_alerts	false		Enable Service Level Health Alerts
SERVICE	HIVE	hiveserver2_keystore_password	false	hive.server2.keystore.password	HiveServer2 TLS/SSL Server JKS Keystore File Password
SERVICE	HIVE	navigator_audit_enabled	false		Enable Audit Collection
SERVICE	HIVE	hiveserver2_keystore_path	false	hive.server2.keystore.path	HiveServer2 TLS/SSL Server JKS Keystore File Location
SERVICE	HIVE	service_triggers	false		Service Triggers
SERVICE	HIVE	service_config_suppression_hive_metastore_database_password	false		Suppress Parameter Validation: Hive Metastore Database Password
SERVICE	HIVE	service_config_suppression_hive_service_replication_config_safety_valve	false		Suppress Parameter Validation: Hive Replication Advanced Configuration Snippet (Safety Valve) for hive-site.xml
SERVICE	HIVE	hiveserver2_ldap_basedn	false	hive.server2.authentication.ldap.baseDN	LDAP BaseDN
SERVICE	HIVE	hive_aux_jars_path_dir	false		Hive Auxiliary JARs Directory
SERVICE	HIVE	service_config_suppression_hive_server2_sentry_safety_valve	false		Suppress Parameter Validation: Hive Service Advanced Configuration Snippet (Safety Valve) for sentry-site.xml
SERVICE	HIVE	hive_service_env_safety_valve	false		Hive Service Environment Advanced Configuration Snippet (Safety Valve)
SERVICE	HIVE	navigator_client_max_num_audit_log	false	navigator.client.max_num_audit_log	Number of Audit Logs to Retain
SERVICE	HIVE	service_config_suppression_hiveserver2_keystore_password	false		Suppress Parameter Validation: HiveServer2 TLS/SSL Server JKS Keystore File Password
SERVICE	HIVE	hiveserver2_ldap_uri	false	hive.server2.authentication.ldap.url	LDAP URL
SERVICE	HIVE	hive_metastore_schema_verification	false	hive.metastore.schema.verification	Strict Hive Metastore Schema Validation
SERVICE	HIVE	hive_bytes_per_reducer	false	hive.exec.reducers.bytes.per.reducer	Hive Bytes Per Reducer
SERVICE	HIVE	service_health_suppression_hive_webhcats_healthy	false		Suppress Health Test: WebHCat Server Health
SERVICE	HIVE	navigator_client_config_safety_valve	false		Hive Client Advanced Configuration Snippet (Safety Valve) for navigator.client.properties
SERVICE	HIVE	process_groupname	false		System Group
SERVICE	HIVE	smon_client_config_overrides	false		Service Monitor Client Config Overrides
SERVICE	HIVE	service_config_suppression_hive_sentry_validator	false		Suppress Configuration Validator: Hive Sentry Validator
SERVICE	HIVE	service_config_suppression_gateway_count_validator	false		Suppress Configuration Validator: Gateway Count Validator
SERVICE	HIVE	navigator_audit_queue_policy	false	navigator.batch.queue_policy	Audit Queue Policy
SERVICE	HIVE	sentry_allow_uri_db_policyfile	false	sentry.allow.uri.db.policyfile	Allow URIs in Database Policy File
SERVICE	HIVE	hive_replication_env_safety_valve	false		Hive Replication Environment Advanced Configuration Snippet (Safety Valve)
SERVICE	HIVE	hive_metastore_database_auto_create_schema	false	datanucleus.autoCreateSchema	Auto Create and Upgrade Hive Metastore Database Schema
SERVICE	HIVE	service_config_suppression_service_triggers	false		Suppress Parameter Validation: Service Triggers
SERVICE	HIVE	service_config_suppression_hive_metastore_database_user	false		Suppress Parameter Validation: Hive Metastore Database User
SERVICE	HIVE	service_config_suppression_hive_proxy_user_groups_list	false		Suppress Parameter Validation: Hive Metastore Access Control and Proxy User Groups Override
SERVICE	HIVE	service_config_suppression_hiveserver2_truststore_password	false		Suppress Parameter Validation: HiveServer2 TLS/SSL Certificate Trust Store Password
SERVICE	HIVE	hive_service_config_safety_valve	false		Hive Service Advanced Configuration Snippet (Safety Valve) for hive-site.xml
SERVICE	HIVE	hive_metastore_database_host	false		Hive Metastore Database Host
SERVICE	HIVE	service_config_suppression_hiveserver2_truststore_file	false		Suppress Parameter Validation: HiveServer2 TLS/SSL Certificate Trust Store File
SERVICE	HIVE	service_config_suppression_hive_service_env_safety_valve	false		Suppress Parameter Validation: Hive Service Environment Advanced Configuration Snippet (Safety Valve)
SERVICE	HIVE	hive_metastore_database_name	false		Hive Metastore Database Name
SERVICE	HIVE	hive_metastore_database_user	false	javax.jdo.option.ConnectionUserName	Hive Metastore Database User
SERVICE	HIVE	hive_metastore_database_type	false		Hive Metastore Database Type
SERVICE	HIVE	service_config_suppression_sentry_metastore_service_users	false		Suppress Parameter Validation: Bypass Sentry Authorization Users
SERVICE	HIVE	service_config_suppression_hiveserver2_ldap_uri	false		Suppress Parameter Validation: LDAP URL
SERVICE	HIVE	service_config_suppression_hive_core_site_safety_valve	false		Suppress Parameter Validation: Hive Service Advanced Configuration Snippet (Safety Valve) for core-site.xml
SERVICE	HIVE	hive_metastore_derby_path	false		Hive Metastore Derby Path
SERVICE	HIVE	hive_sentry_server	false	hive.sentry.server	Server Name for Sentry Authorization
SERVICE	HIVE	service_config_suppression_hive_metastore_derby_path	false		Suppress Parameter Validation: Hive Metastore Derby Path
SERVICE	HIVE	hive_warehouse_directory	false	hive.metastore.warehouse.dir	Hive Warehouse Directory
SERVICE	HIVE	sentry_metastore_service_users	false	sentry.metastore.service.users	Bypass Sentry Authorization Users
SERVICE	HIVE	hiveserver2_truststore_password	false		HiveServer2 TLS/SSL Certificate Trust Store Password
SERVICE	HIVE	hive_metastore_database_password	false	javax.jdo.option.ConnectionPassword	Hive Metastore Database Password
SERVICE	HIVE	navigator_event_tracker	false	navigator_event_tracker	Audit Event Tracker
SERVICE	HIVE	hive_metastore_database_port	false		Hive Metastore Database Port
SERVICE	HIVE	hive_proxy_user_groups_list	false	hadoop.proxyuser.hive.groups	Hive Metastore Access Control and Proxy User Groups Override
SERVICE	HIVE	hive_hiveserver2s_healthy_thresholds	false		Healthy HiveServer2 Monitoring Thresholds
SERVICE	HIVE	hive_service_replication_config_safety_valve	false		Hive Replication Advanced Configuration Snippet (Safety Valve) for hive-site.xml
SERVICE	HIVE	navigator_audit_event_filter	false	navigator.event.filter	Audit Event Filter
SERVICE	HIVE	kerberos_princ_name	false		Kerberos Principal
SERVICE	HIVE	service_config_suppression_hive_metastore_database_host	false		Suppress Parameter Validation: Hive Metastore Database Host
SERVICE	HIVE	hiveserver2_enable_ldap_auth	false		Enable LDAP Authentication
SERVICE	HIVE	service_health_suppression_hive_hiveserver2s_healthy	false		Suppress Health Test: HiveServer2 Health
SERVICE	HIVE	service_config_suppression_hivemetastore_count_validator	false		Suppress Configuration Validator: Hive Metastore Server Count Validator
SERVICE	HIVE	hive_reduce_tasks	false	mapred.reduce.tasks	Hive Reduce Tasks
SERVICE	HIVE	hive_webhcats_healthy_thresholds	false		Healthy WebHCat Server Monitoring Thresholds
SERVICE	HIVE	service_config_suppression_hive_warehouse_directory	false		Suppress Parameter Validation: Hive Warehouse Directory
SERVICE	HIVE	service_config_suppression_hive_derby_validator	false		Suppress Configuration Validator: Hive Derby Validator
SERVICE	HIVE	hive_metastore_database_datanucleus_metadata_validation	false	datanucleus.metadata.validate	Hive Metastore Database DataNucleus Metadata Validation
SERVICE	HIVE	hiveserver2_ldap_domain	false	hive.server2.authentication.ldap.Domain	Active Directory Domain
SERVICE	HIVE	service_config_suppression_kerberos_princ_name	false		Suppress Parameter Validation: Kerberos Principal
SERVICE	HIVE	navigator_audit_log_max_file_size	false	navigator.audit_log_max_file_size	Maximum Audit Log File Size
SERVICE	HIVE	service_config_suppression_hiveserver2_keystore_path	false		Suppress Parameter Validation: HiveServer2 TLS/SSL Server JKS Keystore File Location
SERVICE	HIVE	service_config_suppression_hiveserver2_count_validator	false		Suppress Configuration Validator: HiveServer2 Count Validator
SERVICE	HIVE	service_config_suppression_hive_bypass_metastore_validator	false		Suppress Configuration Validator: Hive Bypass Metastore Validator
SERVICE	HIVE	hive_bypass_metastore_server	false		Bypass Hive Metastore Server
SERVICE	HIVE	service_config_suppression_hive_concurrency_validator	false		Suppress Configuration Validator: Hive Concurrency Configuration Validator
SERVICE	HIVE	service_config_suppression_smon_derived_configs_safety_valve	false		Suppress Parameter Validation: Service Monitor Derived Configs Advanced Configuration Snippet (Safety Valve)
SERVICE	HIVE	hbase_service	false		HBase Service
SERVICE	HIVE	sentry_enabled	false	hive.sentry.enabled	Enable Sentry Authorization using Policy Files
SERVICE	HIVE	service_config_suppression_hiveserver2_ldap_basedn	false		Suppress Parameter Validation: LDAP BaseDN
SERVICE	HIVE	hive_set_ugi	false	hive.metastore.execute.setugi	Set User and Group Information
SERVICE	HIVE	service_config_suppression_webhcat_count_validator	false		Suppress Configuration Validator: WebHCat Server Count Validator
SERVICE	HIVE	hiveserver2_enable_ssl	false	hive.server2.use.SSL	Enable TLS/SSL for HiveServer2
SERVICE	HIVE	service_config_suppression_navigator_event_tracker	false		Suppress Parameter Validation: Audit Event Tracker
SERVICE	HIVE	service_config_suppression_smon_client_config_overrides	false		Suppress Parameter Validation: Service Monitor Client Config Overrides
SERVICE	HIVE	hive_hivemetastores_healthy_thresholds	false		Healthy Hive Metastore Server Monitoring Thresholds
SERVICE	HIVE	service_config_suppression_hive_client_ssl_recommended_with_ldap_auth_validator	false		Suppress Configuration Validator: Client TLS/SSL In Use With LDAP Authentication Validator
SERVICE	HIVE	zookeeper_service	false		ZooKeeper Service
SERVICE	HIVE	service_config_suppression_audit_event_log_dir	false		Suppress Parameter Validation: Audit Log Directory
SERVICE	HIVE	service_config_suppression_hive_service_config_safety_valve	false		Suppress Parameter Validation: Hive Service Advanced Configuration Snippet (Safety Valve) for hive-site.xml
SERVICE	HIVE	hive_core_site_safety_valve	false		Hive Service Advanced Configuration Snippet (Safety Valve) for core-site.xml
SERVICE	HIVE	process_username	false		System User
SERVICE	HIVE	hive_sentry_provider_resource	false	hive.sentry.provider.resource	Sentry Global Policy File
SERVICE	HIVE	enable_config_alerts	false		Enable Configuration Change Alerts
SERVICE	HIVE	service_health_suppression_hive_hivemetastores_healthy	false		Suppress Health Test: Hive Metastore Server Health
SERVICE	HIVE	service_config_suppression_hive_metastore_database_name	false		Suppress Parameter Validation: Hive Metastore Database Name
SERVICE	HIVE	sentry_service	false		Sentry Service
SERVICE	HIVE	hive_metastore_database_datanucleus_try_direct_sql	false	hive.metastore.try.direct.sql	Enable Direct SQL
SERVICE	HIVE	service_config_suppression_hive_aux_jars_path_dir	false		Suppress Parameter Validation: Hive Auxiliary JARs Directory
SERVICE	HIVE	hive_warehouse_subdir_inherit_perms	false	hive.warehouse.subdir.inherit.perms	Hive Warehouse Subdirectories Inherit Permissions
SERVICE	HIVE	service_config_suppression_hive_proxy_groups_validator	false		Suppress Configuration Validator: Hive Proxy Groups Validator
ROLE	WEBHCAT	role_config_suppression_hive_webhcat_hive_config_safety_valve	false		Suppress Parameter Validation: WebHCat Server Advanced Configuration Snippet (Safety Valve) for hive-site.xml
ROLE	WEBHCAT	role_health_suppression_webhcat_unexpected_exits	false		Suppress Health Test: Unexpected Exits
ROLE	WEBHCAT	stacks_collection_data_retention	false	stacks_collection_data_retention	Stacks Collection Data Retention
ROLE	WEBHCAT	log_threshold	false		WebHCat Server Logging Threshold
ROLE	WEBHCAT	role_config_suppression_cdh_version_validator	false		Suppress Configuration Validator: CDH Version Validator
ROLE	WEBHCAT	webhcat_scm_health_enabled	false		WebHCat Server Process Health Test
ROLE	WEBHCAT	stacks_collection_enabled	false	stacks_collection_enabled	Stacks Collection Enabled
ROLE	WEBHCAT	role_health_suppression_webhcat_log_directory_free_space	false		Suppress Health Test: Log Directory Free Space
ROLE	WEBHCAT	role_config_suppression_hive_webhcat_config_safety_valve	false		Suppress Parameter Validation: WebHCat Server Advanced Configuration Snippet (Safety Valve) for webhcat-site.xml
ROLE	WEBHCAT	enable_alerts	false		Enable Health Alerts for this Role
ROLE	WEBHCAT	rm_memory_soft_limit	false	memory.soft_limit_in_bytes	Cgroup Memory Soft Limit
ROLE	WEBHCAT	process_auto_restart	false		Automatically Restart Process
ROLE	WEBHCAT	oom_heap_dump_dir	false	oom_heap_dump_dir	Heap Dump Directory
ROLE	WEBHCAT	hive_webhcat_address_port	false	templeton.port	WebHCat Server Port
ROLE	WEBHCAT	role_config_suppression_log4j_safety_valve	false		Suppress Parameter Validation: WebHCat Server Logging Advanced Configuration Snippet (Safety Valve)
ROLE	WEBHCAT	rlimit_fds	false		Maximum Process File Descriptors
ROLE	WEBHCAT	role_health_suppression_webhcat_swap_memory_usage	false		Suppress Health Test: Swap Memory Usage
ROLE	WEBHCAT	max_log_size	false		WebHCat Server Max Log Size
ROLE	WEBHCAT	log4j_safety_valve	false		WebHCat Server Logging Advanced Configuration Snippet (Safety Valve)
ROLE	WEBHCAT	unexpected_exits_thresholds	false		Unexpected Exits Thresholds
ROLE	WEBHCAT	role_config_suppression_hive_webhcat_env_safety_valve	false		Suppress Parameter Validation: WebHCat Server Environment Advanced Configuration Snippet (Safety Valve)
ROLE	WEBHCAT	stacks_collection_frequency	false	stacks_collection_frequency	Stacks Collection Frequency
ROLE	WEBHCAT	log_directory_free_space_percentage_thresholds	false		Log Directory Free Space Monitoring Percentage Thresholds
ROLE	WEBHCAT	log_directory_free_space_absolute_thresholds	false		Log Directory Free Space Monitoring Absolute Thresholds
ROLE	WEBHCAT	oom_heap_dump_enabled	false		Dump Heap When Out of Memory
ROLE	WEBHCAT	hive_webhcat_java_heapsize	false		Java Heap Size of WebHCat Server in Bytes
ROLE	WEBHCAT	max_log_backup_index	false		WebHCat Server Maximum Log File Backups
ROLE	WEBHCAT	heap_dump_directory_free_space_percentage_thresholds	false		Heap Dump Directory Free Space Monitoring Percentage Thresholds
ROLE	WEBHCAT	unexpected_exits_window	false		Unexpected Exits Monitoring Period
ROLE	WEBHCAT	role_health_suppression_webhcat_host_health	false		Suppress Health Test: Host Health
ROLE	WEBHCAT	stacks_collection_method	false	stacks_collection_method	Stacks Collection Method
ROLE	WEBHCAT	hive_webhcat_env_safety_valve	false		WebHCat Server Environment Advanced Configuration Snippet (Safety Valve)
ROLE	WEBHCAT	webhcat_fd_thresholds	false		File Descriptor Monitoring Thresholds
ROLE	WEBHCAT	role_health_suppression_webhcat_scm_health	false		Suppress Health Test: Process Status
ROLE	WEBHCAT	webhcat_host_health_enabled	false		WebHCat Server Host Health Test
ROLE	WEBHCAT	hive_webhcat_hive_config_safety_valve	false		WebHCat Server Advanced Configuration Snippet (Safety Valve) for hive-site.xml
ROLE	WEBHCAT	role_config_suppression_stacks_collection_directory	false		Suppress Parameter Validation: Stacks Collection Directory
ROLE	WEBHCAT	oom_sigkill_enabled	false		Kill When Out of Memory
ROLE	WEBHCAT	role_config_suppression_oom_heap_dump_dir	false		Suppress Parameter Validation: Heap Dump Directory
ROLE	WEBHCAT	rm_memory_hard_limit	false	memory.limit_in_bytes	Cgroup Memory Hard Limit
ROLE	WEBHCAT	rm_cpu_shares	false	cpu.shares	Cgroup CPU Shares
ROLE	WEBHCAT	role_config_suppression_role_triggers	false		Suppress Parameter Validation: Role Triggers
ROLE	WEBHCAT	role_health_suppression_webhcat_heap_dump_directory_free_space	false		Suppress Health Test: Heap Dump Directory Free Space
ROLE	WEBHCAT	hive_webhcat_java_opts	false		Java Configuration Options for WebHCat Server
ROLE	WEBHCAT	stacks_collection_directory	false	stacks_collection_directory	Stacks Collection Directory
ROLE	WEBHCAT	heap_dump_directory_free_space_absolute_thresholds	false		Heap Dump Directory Free Space Monitoring Absolute Thresholds
ROLE	WEBHCAT	rm_io_weight	false	blkio.weight	Cgroup I/O Weight
ROLE	WEBHCAT	enable_config_alerts	false		Enable Configuration Change Alerts
ROLE	WEBHCAT	role_health_suppression_webhcat_file_descriptor	false		Suppress Health Test: File Descriptors
ROLE	WEBHCAT	role_triggers	false		Role Triggers
ROLE	WEBHCAT	process_swap_memory_thresholds	false		Process Swap Memory Thresholds
ROLE	WEBHCAT	hive_webhcat_config_safety_valve	false		WebHCat Server Advanced Configuration Snippet (Safety Valve) for webhcat-site.xml
ROLE	WEBHCAT	hcatalog_log_dir	false		WebHCat Server Log Directory
ROLE	WEBHCAT	role_config_suppression_hcatalog_log_dir	false		Suppress Parameter Validation: WebHCat Server Log Directory
ROLE	WEBHCAT	role_config_suppression_hive_webhcat_java_opts	false		Suppress Parameter Validation: Java Configuration Options for WebHCat Server
ROLE	HIVEMETASTORE	hive_log_dir	false		Hive Metastore Server Log Directory
ROLE	HIVEMETASTORE	stacks_collection_data_retention	false	stacks_collection_data_retention	Stacks Collection Data Retention
ROLE	HIVEMETASTORE	log_threshold	false		Hive Metastore Server Logging Threshold
ROLE	HIVEMETASTORE	role_config_suppression_cdh_version_validator	false		Suppress Configuration Validator: CDH Version Validator
ROLE	HIVEMETASTORE	stacks_collection_enabled	false	stacks_collection_enabled	Stacks Collection Enabled
ROLE	HIVEMETASTORE	hivemetastore_scm_health_enabled	false		Hive Metastore Server Process Health Test
ROLE	HIVEMETASTORE	role_health_suppression_hivemetastore_file_descriptor	false		Suppress Health Test: File Descriptors
ROLE	HIVEMETASTORE	enable_alerts	false		Enable Health Alerts for this Role
ROLE	HIVEMETASTORE	rm_memory_soft_limit	false	memory.soft_limit_in_bytes	Cgroup Memory Soft Limit
ROLE	HIVEMETASTORE	process_auto_restart	false		Automatically Restart Process
ROLE	HIVEMETASTORE	oom_heap_dump_dir	false	oom_heap_dump_dir	Heap Dump Directory
ROLE	HIVEMETASTORE	role_health_suppression_hivemetastore_scm_health	false		Suppress Health Test: Process Status
ROLE	HIVEMETASTORE	hivemetastore_pause_duration_window	false		Pause Duration Monitoring Period
ROLE	HIVEMETASTORE	hive_metastore_env_safety_valve	false		Hive Metastore Server Environment Advanced Configuration Snippet (Safety Valve)
ROLE	HIVEMETASTORE	role_config_suppression_log4j_safety_valve	false		Suppress Parameter Validation: Hive Metastore Server Logging Advanced Configuration Snippet (Safety Valve)
ROLE	HIVEMETASTORE	rlimit_fds	false		Maximum Process File Descriptors
ROLE	HIVEMETASTORE	log4j_safety_valve	false		Hive Metastore Server Logging Advanced Configuration Snippet (Safety Valve)
ROLE	HIVEMETASTORE	max_log_size	false		Hive Metastore Server Max Log Size
ROLE	HIVEMETASTORE	unexpected_exits_thresholds	false		Unexpected Exits Thresholds
ROLE	HIVEMETASTORE	role_config_suppression_hive_log_dir	false		Suppress Parameter Validation: Hive Metastore Server Log Directory
ROLE	HIVEMETASTORE	stacks_collection_frequency	false	stacks_collection_frequency	Stacks Collection Frequency
ROLE	HIVEMETASTORE	hive_metastore_max_threads	false	hive.metastore.server.max.threads	Max Hive Metastore Server Threads
ROLE	HIVEMETASTORE	log_directory_free_space_percentage_thresholds	false		Log Directory Free Space Monitoring Percentage Thresholds
ROLE	HIVEMETASTORE	log_directory_free_space_absolute_thresholds	false		Log Directory Free Space Monitoring Absolute Thresholds
ROLE	HIVEMETASTORE	hive_metastore_java_heapsize	false		Java Heap Size of Hive Metastore Server in Bytes
ROLE	HIVEMETASTORE	oom_heap_dump_enabled	false		Dump Heap When Out of Memory
ROLE	HIVEMETASTORE	max_log_backup_index	false		Hive Metastore Server Maximum Log File Backups
ROLE	HIVEMETASTORE	heap_dump_directory_free_space_percentage_thresholds	false		Heap Dump Directory Free Space Monitoring Percentage Thresholds
ROLE	HIVEMETASTORE	unexpected_exits_window	false		Unexpected Exits Monitoring Period
ROLE	HIVEMETASTORE	stacks_collection_method	false	stacks_collection_method	Stacks Collection Method
ROLE	HIVEMETASTORE	role_config_suppression_hive_metastore_java_opts	false		Suppress Parameter Validation: Java Configuration Options for Hive Metastore Server
ROLE	HIVEMETASTORE	role_health_suppression_hivemetastore_swap_memory_usage	false		Suppress Health Test: Swap Memory Usage
ROLE	HIVEMETASTORE	role_health_suppression_hivemetastore_canary_health	false		Suppress Health Test: Hive Metastore Canary
ROLE	HIVEMETASTORE	role_health_suppression_hivemetastore_pause_duration	false		Suppress Health Test: Pause Duration
ROLE	HIVEMETASTORE	hive_metastore_config_safety_valve	false		Hive Metastore Server Advanced Configuration Snippet (Safety Valve) for hive-site.xml
ROLE	HIVEMETASTORE	role_config_suppression_stacks_collection_directory	false		Suppress Parameter Validation: Stacks Collection Directory
ROLE	HIVEMETASTORE	oom_sigkill_enabled	false		Kill When Out of Memory
ROLE	HIVEMETASTORE	role_config_suppression_oom_heap_dump_dir	false		Suppress Parameter Validation: Heap Dump Directory
ROLE	HIVEMETASTORE	hivemetastore_host_health_enabled	false		Hive Metastore Server Host Health Test
ROLE	HIVEMETASTORE	rm_memory_hard_limit	false	memory.limit_in_bytes	Cgroup Memory Hard Limit
ROLE	HIVEMETASTORE	role_config_suppression_hive_metastore_env_safety_valve	false		Suppress Parameter Validation: Hive Metastore Server Environment Advanced Configuration Snippet (Safety Valve)
ROLE	HIVEMETASTORE	rm_cpu_shares	false	cpu.shares	Cgroup CPU Shares
ROLE	HIVEMETASTORE	role_health_suppression_hivemetastore_unexpected_exits	false		Suppress Health Test: Unexpected Exits
ROLE	HIVEMETASTORE	role_config_suppression_role_triggers	false		Suppress Parameter Validation: Role Triggers
ROLE	HIVEMETASTORE	stacks_collection_directory	false	stacks_collection_directory	Stacks Collection Directory
ROLE	HIVEMETASTORE	heap_dump_directory_free_space_absolute_thresholds	false		Heap Dump Directory Free Space Monitoring Absolute Thresholds
ROLE	HIVEMETASTORE	role_health_suppression_hivemetastore_heap_dump_directory_free_space	false		Suppress Health Test: Heap Dump Directory Free Space
ROLE	HIVEMETASTORE	role_config_suppression_hive_metastore_config_safety_valve	false		Suppress Parameter Validation: Hive Metastore Server Advanced Configuration Snippet (Safety Valve) for hive-site.xml
ROLE	HIVEMETASTORE	hive_metastore_port	false	hive.metastore.port	Hive Metastore Server Port
ROLE	HIVEMETASTORE	rm_io_weight	false	blkio.weight	Cgroup I/O Weight
ROLE	HIVEMETASTORE	hivemetastore_fd_thresholds	false		File Descriptor Monitoring Thresholds
ROLE	HIVEMETASTORE	role_health_suppression_hivemetastore_host_health	false		Suppress Health Test: Host Health
ROLE	HIVEMETASTORE	enable_config_alerts	false		Enable Configuration Change Alerts
ROLE	HIVEMETASTORE	hivemetastore_pause_duration_thresholds	false		Pause Duration Thresholds
ROLE	HIVEMETASTORE	role_triggers	false		Role Triggers
ROLE	HIVEMETASTORE	role_health_suppression_hivemetastore_log_directory_free_space	false		Suppress Health Test: Log Directory Free Space
ROLE	HIVEMETASTORE	process_swap_memory_thresholds	false		Process Swap Memory Thresholds
ROLE	HIVEMETASTORE	hive_metastore_min_threads	false	hive.metastore.server.min.threads	Min Hive Metastore Server Threads
ROLE	HIVEMETASTORE	metastore_canary_health_enabled	false		Hive Metastore Canary Health Test
ROLE	HIVEMETASTORE	hive_metastore_java_opts	false		Java Configuration Options for Hive Metastore Server
ROLE	HIVESERVER2	role_config_suppression_hive_hs2_env_safety_valve	false		Suppress Parameter Validation: HiveServer2 Environment Advanced Configuration Snippet (Safety Valve)
ROLE	HIVESERVER2	hive_log_dir	false		HiveServer2 Log Directory
ROLE	HIVESERVER2	hiveserver2_enable_mapjoin	false	hive.auto.convert.join	Enable MapJoin Optimization
ROLE	HIVESERVER2	hs2_thrift_address_port	false	hive.server2.thrift.port	HiveServer2 Port
ROLE	HIVESERVER2	log_threshold	false		HiveServer2 Logging Threshold
ROLE	HIVESERVER2	stacks_collection_data_retention	false	stacks_collection_data_retention	Stacks Collection Data Retention
ROLE	HIVESERVER2	hiveserver2_fd_thresholds	false		File Descriptor Monitoring Thresholds
